"data__story","data__message","data__updated_time","data__id","paging__previous","paging__next"
"","מסבלטת את החדר שלי בדירת שניים וחצי חדרים במרכז תל אביב, בין ה15.8-29.8. הדירה נמצאת במיקום מעולה, רחוב קרית ספר (מול הסינמטק), קרוב להכל!! בדירה נשארת שותפתי המקסימה וגם כלבה קטנה ומהממת. 2000 ש""ח כולל הכל.  I`m subletting my amazing room in our 2.5 bedrooms apartment during the 15-29 of August. Great location, next to Tel Aviv Cinematheque, center of Tel Aviv in Kiryat Sefer st. My roommate and her little dog are staying in the apartment. price :2000 NIS (includes bills)","2015-07-09T08:40:41+0000","707688259256219_1028841193807589","",""
"","","2015-07-09T08:29:12+0000","707688259256219_1028838610474514","",""
"","דירה לזוג + כלב? חודש עד 4000 כולל הכל באיזור המרכז ?","2015-07-09T08:09:01+0000","707688259256219_1028826050475770","",""
"","מסאבלט את החדר שלי בין התאריכים 29.7-22.8 . החדר גדול מאוד ועם מרפסת פרטית. החדר בדירת 4 חדרים ברחוב ז'בוטינסקי 54 תל אביב,בדירה נשארים שותף ושותפה שקטים ומסודרים. המיקום מציון וקרוב להכל- תחבורה ציבורית, ים, סופרים, מקומות בילוי קניות וכל מה שצריך ויחד עם זאת האזור עצמו שקט! המחיר הוא 1750 כולל הכל! יש אפשרות להשאיר גם את האופניים החשמליות לתקופת הסאבלט.  לפרטים : או בהודעה פרטית או בנייד : 0546960979","2015-07-09T06:41:07+0000","707688259256219_1028809687144073","",""
"","סבלט בקפלן פינת אבן גבירול :  מתי? 8.9 - 19.9 כמה? 1500  בדירה נשאר שותף.","2015-07-09T05:12:28+0000","707688259256219_1028789873812721","",""
"","","2015-07-09T04:39:56+0000","707688259256219_1028615237163518","",""
"","היי, מחפשת סבלט מסוף אוגוסט- תחילת ספטמבר לחודש עד 4000 כולל הכל. באיזור מרכז עדיפות קרוב לסנטר, בלי שותפים ,לזוג + כלב (:","2015-07-09T01:50:52+0000","707688259256219_1028737993817909","",""
"Julia Fridman shared Mojo - short term apartment rentals in Tel Aviv's post to the group: ‎סבלט בתל אביב לתקופות קצרות‎.","Short term/vacation rental: minutes from Gordon beach, 6th floor, 3 bedroom, 2 bathrooms with a huge living room and dining area. The apartment features a comfortable closed balcony with a cushion seat, fits 7. 100 meters squared!  Amenities: Parking, elevator, washer and dryer, dish washer, linens and towels, main bedroom has an en-suite bathroom, wifi, cable TV.  Prices start from: $240/night + $90 final cleaning fee.  mojoaptlv@gmail.com/ +972532775864","2015-07-08T23:36:49+0000","707688259256219_1028679413823767","",""
"","להשכרה ל  בין ה 23.7 ל 29.7 דירה מדליקה בגאולה ליד הים 3 חדרים משופצת עם מירפסת גן מחיר 2500 לפרטים 0542098296","2015-07-08T21:48:27+0000","707688259256219_1028649767160065","",""
"Tal Zur shared her post to the group: ‎סבלט בתל אביב לתקופות קצרות‎.","","2015-07-08T20:06:45+0000","707688259256219_1028608393830869","",""
"","","2015-07-08T19:58:01+0000","707688259256219_1028605913831117","",""
"","שלום לכם, מחפשת דירה 20/7-14/8 בתל אביב לזוג עם ילדה.","2015-07-08T19:39:42+0000","707688259256219_1028599803831728","",""
"Ayten  Khanuka shared her post to the group: ‎סבלט בתל אביב לתקופות קצרות‎.","סבלט לתקופת החגים... אשמח אם תפיצו :-)","2015-07-08T18:33:26+0000","707688259256219_1028540203837688","",""
"","אהלן! מחפש לסבלט חדר במיידי עד ה12/8. אזור מרכז/צפון ישן. תודה!","2015-07-08T17:48:19+0000","707688259256219_1028524193839289","",""
"","","2015-07-08T15:48:30+0000","707688259256219_1028483930509982","",""
"","שווה!!! מסבלטת את החדר הגדול שלי, בתוך דירת 3 חדרים בת""א בצפון הישן, לחודש וחצי- 17/7-30/8. יש מזגן ומרפסת, מטבח מאובזר, חמש דק' הליכה לים ולפארק הירקון, בדירה נשארות 2 שותפות מקסימות!! 4500 ש""ח כולל כל החשבונות לחודש וחצי. לפרטים מהרו לפנות אליי.","2015-07-08T14:02:14+0000","707688259256219_1028399967185045","",""
"","For short term-Best apt in the BEST location! Beautiful one bed apartment with a big bed & sofa bed. Really cozy and clean. on a quiet St. next to Dizengoff St. and next to all the bars and restaurants, close to the sea and amazing beaches. https://www.airbnb.com/rooms/6768046  300 per night For more details' in private message.","2015-07-08T13:36:00+0000","707688259256219_1028435473848161","",""
"","סבלט בלב ת'א  6.8-23.8  למשפחה נחמדה עד 5 נפשות  ברחוב בלפור המוצל והשווה  100מ' ,מזגנים מרפסות ,אינטרנט וחתול אחד  7500 שקלים כולל הכל לפרטים  אורנה  0545248882","2015-07-08T12:09:41+0000","707688259256219_1028403293851379","",""
"","סבלט. מסבלט חדר ענק, ממש בגודל של דירה קטנה, בדירת 3 חדרים (משופצת) בכיכר רבין. החדר בא עם פלייסטיישן 4 ושותפה בחדר השני.  25.8-30.9. 2800 ש""ח.","2015-07-08T11:57:21+0000","707688259256219_1028395933852115","",""
"","אהלן! מחפש לסבלט חדר מ19 ביולי עד 17 באוגוסט.. לא משנה איפה בתל אביב או באיזור..רצוי במחיר סבבה.. מביא עוגיות;)","2015-07-08T11:18:30+0000","707688259256219_1028383553853353","",""
"","מסבלטת את החדר שלי בדירת שניים וחצי חדרים במרכז תל אביב, בין ה15.8-29.8. הדירה נמצאת במיקום מעולה, רחוב קרית ספר (מול הסינמטק), קרוב להכל!! בדירה נשארת שותפתי המקסימה וגם כלבה קטנה ומהממת. 2000 ש""ח כולל הכל.","2015-07-08T10:55:30+0000","707688259256219_1028377853853923","",""
"","Center TLV - Close to the beach - 3BD Room Short term rent amazing APT available for long term also Balcony Sea View You will enjoy a brand new welcoming apartment, look & feel of your home.  Fast internet, brand new electric gear. Brand new kitchen. A/C Fully furnished בבניין חדש! דירת שלושה חדרים מפנקת קרובה לים. דירה חדשה ברמה גבוהה כולל ריהוט מלא. רק להביא בגדים משפחה עד 6 אנשים, יש מעליות, מרפסת שמש.  קרוב מאוד ל: דיזינגוף סנטר, ים, שוק הכרמל, נווה צדק, תחבורה ציבורית בשפע. מחיר לדירה כולל חשבונות לא כולל חשמל 10,200 גמיש מעט","2015-07-08T08:15:25+0000","707688259256219_1028341963857512","",""
"","","2015-07-08T08:12:01+0000","707688259256219_1028341163857592","",""
"","מסבלטים את דירתנו המהממת לחודש ספטמבר  9/9 - 8/10 הדירה מפנקת ברמות של צימר. 7000ש""ח פרטים נוספים בקישור או שילחו הודעה.","2015-07-08T07:57:12+0000","707688259256219_1028337787191263","",""
"","cute apartment or sublet דירה חמודה לסיבלוט","2015-07-08T07:55:47+0000","707688259256219_1028337500524625","",""
"","דירה לשבת הקרובה ליד הים. אני, אישתי ואח של אישתי שנוחת מסן פרנסיסקו. יש הצעות? לפני שאנחנו סוגרים מלון..","2015-07-08T07:35:53+0000","707688259256219_1028325277192514","",""
"","שלום לכולם, ידיד שלי מחפש מיידית חדר לחודש ימים בתל אביב או באזור תל אביב, אשמח אם מישהו יכול לעזור.","2015-07-08T07:34:55+0000","707688259256219_1028328960525479","",""
"","אז ככה אני Mati Yudaikin ו Yohai Vanhotsker החלטנו לעזוב הכל ולנסוע להודו בתאריכים שבין ה20 באוגוסט ל24 באוקטובר , אנחנו מחפשים לסבלט את השתי החדרים האדירים האלו ... מתוך שלושה , משאירים מאחורינו שותפה מדהימה וחתול קטן וחמוד . הדירה ממוקמת ברחוב החלוצים בשכונת פלורנטין והשכירות  היא 2150 בלי חשבונות ארנונה וחשמל . לשלוח הודעה בפרטי .","2015-07-08T07:30:39+0000","707688259256219_1028331060525269","",""
"","רחוב נחל הבשור 1 ביפו, מסבלטת את החדר שלי לשבוע וקצת מ- 10/7-19/7, בבית יש הכל, סלון יפהפה, מטבח גדול, נוף משגע... עדיף מישהו/י מעל גיל 27. בבית נשאר שותף :-) 800 ש''ח כולל הכל עיינה- 0584508900","2015-07-08T07:02:53+0000","707688259256219_1028325257192516","",""
"","","2015-07-08T06:35:15+0000","707688259256219_1028320237193018","",""
"","https://www.facebook.com/kobiji/media_set?set=a.10153053203105835.1073741865.549305834&type=3","2015-07-08T04:09:23+0000","707688259256219_1028278157197226","",""
"","שלום לכולם, אני נוסע ומסאבלט את הדירה שלי! תאריכים : 11.09 – 03.10 זה יוצא בתקופת החגים. הדירה ממוקמת ברחוב אבן גבירול ממש מול כיכר רבין. הדירה מאובזרת וכוללת מטבח קטן עם כל מה שצריך, מזגן, טלוויזיה עם כל ערוצי הוט, אינטרנט אלחוטי רק לארוז בגדים ולהיכנס. הדירה מתאימה ליחיד אפשרות לזוג והיא בגודל 35 מ""ר.  המחיר הוא 4,000 שקלים כולל כל החשבונות.  פרטים נוספים בפרטי","2015-07-07T23:21:19+0000","707688259256219_1028191673872541","",""
"","סאבלט דירת סטודיו נוחה וחמודה ליד רוטשילד  מתאריך 15/7 עד 31 גמיש  1900 ש""ח  בפרטי","2015-07-07T22:39:57+0000","707688259256219_1027938270564548","",""
"","היי כולם, סבלט החל מספטמבר ועד ינואר במתחם נגה. הדירה נעימה, מרווחת ומוארת באזור מדהים שנייה מהים, שכד 5100 בלי חשבונות...םרטים נוספים אצלי 😊","2015-07-07T20:40:44+0000","707688259256219_1027913393900369","",""
"","חברים אני בעלי והילדה מחפשים במיידי דירת סבלט בתא , ( מרכז ) חשוב לנו שהדירה תהיה מסודרת ונקיה .בתאריך 15.7 עד 8.8  כל מי שמכיר או יודע שיפנה אלי בפרטי. תודה רבה","2015-07-07T19:47:01+0000","707688259256219_1028121557212886","",""
"","***סבלט בחגים במרכז תל אביב*** בוגרשוב 92 פינת המליץ, ליד דיזינגוף סנטר, דירת שניים וחצי חדרים משופצת ומאובזרת, מזגנים, מכונת כביסה ואפילו 2 שירותים. מסבלטים בין התאריכים 5.9-6.10, מחיר 5100 פרטים בפרטי או בטלפון 050-7823563","2015-07-07T18:38:08+0000","707688259256219_1028091323882576","",""
"","Short term/vacation rental only: Check out our new beach pad on Ben Yehuda and Nordau!  Offering at a special price of $99.00/night in July ;)","2015-07-07T17:31:22+0000","707688259256219_1028034330554942","",""
"","אני מחפשת סבלט (חביב ולא יקר) בתל אביב לשלושה/ארבעה אנשים בין התאריכים 26/8-02/09  אנא עזרתכם  I am looking for a not expensive cute apartment for 4/3 people in Tel Aviv between the dates 26 / 08-02 / 09 if you know or hear about something like this, please PM 🙏😘   je suis à la recherche d'un appartement pas trop chere pour 3/4 personnes du 26 Aout au 2 Septembre, si vous avez ou entendez parler d'un plan comme ca merci de me contacter en privé","2015-07-07T14:02:12+0000","707688259256219_1027978097227232","",""
"","סבלט בדירה מהממת ברחוב כצנלסון גבעתיים (מטר מכל הפאבים ובתי הקפה). הדירה משופצת ומסודרת. יש בה סלון גדול, מטבח ענק עם כל מה שצריך והיא מרוהטת כולה. בחדר ארון, שולחן כתיבה ומיטה. בדירה נשארת שותפה מקסימה. תאריך כניסה: מיידי וגמיש שכ""ד 2,000 ש""ח לחודש לפרטים צלצלו ליריב - 0505708424 יאללה בואו לראות :)","2015-07-07T13:30:48+0000","707688259256219_1027906063901102","",""
"","אני ובעלי מחפשים סאבלט מיידי עד תחילת אוגוסט או לפני למינימום שבועיים. נשמח גם לעשות בייביסיטר לכלב/חתול. אנחנו מעשנים. תודה..","2015-07-07T12:17:14+0000","707688259256219_1027936767231365","",""
"","בעקבות פרידה מבן זוג, מחפשת סבלט לכניסה מיידית וגמישה עד סוף ספטמבר בצפון הישן איזור נורדאו דיזנגוף פרישמן וכו׳, עדיפות לדירת רוווקות באווירה חמה ונעימה :) עד 3000 כולל. בפרטי 🙏","2015-07-07T12:16:42+0000","707688259256219_1027907307234311","",""
"","סאבלט בדירה היסטרית במרכז תל אביב !  12/07-12/08 (גמישה בתאריכים) הדירה מאובזרת בה-כ-ל ! (כולל ויי-פיי ויס) 3000 ש""ח כולל הכל לכל התקופה. פרטים בפרטי :)","2015-07-07T12:09:06+0000","707688259256219_1027465980611777","",""
"","2015 Latest-Ray Ban-Sunglasses Online.Click here: <3 http://goods-rrb.ga <3  Buy Now, Not Long Time Lowest Price, Thx.","2015-07-07T11:02:50+0000","707688259256219_1027917287233313","",""
"","מאובזרת קומפלט (מכונת כביסה, טלויזיה, תנור וזה..) ואפילו חצר,  בשכונת הדר יוסף לחודש/חודשיים כולל כבלים/אינטרנט/מים/ארנונה בפרטי, ג'סי  0542212353","2015-07-07T10:50:39+0000","707688259256219_1027914073900301","",""
"","סאבלט בדירה היסטרית במרכז תל אביב !  12/07-12/08 (גמישה בתאריכים) הדירה מאובזרת בה-כ-ל ! (כולל ויי-פיי ויס) 3000 ש""ח כולל הכל לכל התקופה. פרטים בפרטי :)","2015-07-07T10:41:14+0000","707688259256219_1027909810567394","",""
"","https://www.facebook.com/eva.axelrod/posts/10153381127675750","2015-07-07T10:27:42+0000","707688259256219_1027906833901025","",""
"","","2015-07-07T10:26:37+0000","707688259256219_1026960290662346","",""
"","","2015-07-07T09:58:25+0000","707688259256219_1027898517235190","",""
"","https://www.facebook.com/kobiji/media_set?set=a.10153053203105835.1073741865.549305834&type=3","2015-07-07T09:52:22+0000","707688259256219_1027897100568665","",""
"","לא יודעת למה מחקו לי את הפוסט.. בכל אופן אני מחפשת דירה בתא עבורי ועבור חבר תייר גרמני שמגיע לביקור בארץ.. 17-21.07  בחור בן 30 מנומס ושקט אשמח להצעות תודה","2015-07-07T09:50:41+0000","707688259256219_1025118187513223","",""
"","מסבלטת את הדירה שלי, החל מה12 ליולי (12-7-15) והלאה עם גמישות בתאריכים לתקופות קצרות/ ארוכות 60 מ""ר 2 חדרים, מרפסת שמש, שקטה, מזגן, מרוהטת לחלוטין, מטבח מאובזר, שכנים דבש, אינטרנט, קרוב לים, לפארק, לדיזנגוף ולככר רבין. מחיר גמיש תלוי בתקופה כולל חשבונות 054-5225280 בבקשה לשלוח הודעה בפרטי","2015-07-07T09:44:37+0000","707688259256219_1026954677329574","",""
"","מסבלט דירתי ה 2.5 חדרים לפנים +גינה ++++ בשכונת התקווה מה 15/7 עד 1/9.  3200 כולל חשבונות.","2015-07-07T09:00:56+0000","707688259256219_1027829457242096","",""
"","מסבלטים את הדירה המקסימה שלנו בין 4-26 באוגוסט. דירת קרקע+חצר במרכז ת״א, קרובה לים, מתאימה למשפחה בת חמש נפשות. מוזמנים לשתף משפחות חמודות במיוחד :) 200$ ללילה כולל הכל, הנחה לכל התקופה -- Apartment available for summer rental. August 4-26th. Central Tel Aviv,close to the sea. Sleeps 5. Please Share with nice people","2015-07-07T08:47:30+0000","707688259256219_1027884963903212","",""
"","------Men Only-------  Beautiful Room for rent near Rothschild !!!  SHARE WITH TWO MALES  AVAILABLE JULY 12TH.  Hachashmal 20 st  2900/month includes everything.  Wifi,A/C,Washer....Couch,Bed and big closet too.","2015-07-07T08:35:19+0000","707688259256219_1027875550570820","",""
"","מה קורה אנשים?  אני מחפש להכנס שותף בשכירות על דירה בתל אביב שהשכר דירה בה הוא ברצפה. פחות מאלף. כבר הייתי שותף בדירת עשרה אנשים בפלורנטין, כולם היו אנשים מגניבים והשכר דירה היה כמה מאות.  אם יש קונספט כזה בעיר לט מי נואו.","2015-07-07T07:58:50+0000","707688259256219_1027715160586859","",""
"","סאבלט! מסבלט את דירתי ברחוב כפר גלעדי בתאריכים 23/8 - 13/9. דירת שני חדרים - סלון מאובזר עם טלויזיה גדולה, מערכת סאונד, ספת ר' אימתנית וחדר שינה מרווח. מזגנים בשני החדרים. מתאימה לזוג או ליחיד. 3000 ש""ח כולל הכל. פרטים נוספים בפרטי!","2015-07-07T07:51:30+0000","707688259256219_1027874653904243","",""
"","https://www.facebook.com/kobiji/media_set?set=a.10151993141440835.1073741838.549305834&type=3","2015-07-07T07:44:13+0000","707688259256219_1027344597290582","",""
"","סאבלט ביפו בתאריכים 12.7-20.7!!! בדוד רזיאל 3!!!! דירת חמישה חדרים מדהימה ויפה! החדר גדול עם מיטה זוגית ,ארון ,שולחן כתיבה ,שולחן ישיבה  ומזגן :) מטבח מאובזר מרפסת ענקית +מרפסת שמש וסלון ענק עם חלונות מדהימים !!!!! המחיר 690 כולל הכל! !!!! והכי חשוב שותפים מדהימים !!!!!","2015-07-07T07:35:40+0000","707688259256219_1027864880571887","",""
"","","2015-07-07T06:56:59+0000","707688259256219_1026736294018079","",""
"","סאבלט ביפו. שישה ימים. החל מה14 ביולי עד ה20.  רחוב האתרוג. שלוש מאות מטר מהים. שכונת עג'מי. 800 שח.  תודה  Sublett in Jaffa . For six days . Starting from July 14 to 20. Quiet area . 300 meters from the sea . You can walk. 800 shekels . Thanks","2015-07-07T06:49:25+0000","707688259256219_1026739577351084","",""
"","שווה!! מסבלטת את החדר הגדול שלי בתוך דירת 3 חדרים בת""א בצפון הישן, לחודש וחצי - 17/7- 30/8. יש מזגן ומרפסת, מטבח מאובזר, חמש דק הליכה לים ולפארק הירקון, בדירה נשארות שתי שותפות מקסימות!! 4500 ש""ח כולל כל החשבונות. לפרטים מהרו לפנות אליי. קיץ שמח!","2015-07-07T06:29:09+0000","707688259256219_1027848893906819","",""
"","דירת 2 חדרים מגניבה ברחוב הנביאים,מתאימה לזוג או לבודד, חדר שינה אחד. קרובה לכיכר רבין, כיכר הבימה ודיזינגוף סנטר. פנויה במהלך כל חודש ספטמבר, 3.09 - 2.10 . המחיר לכל התקופה הוא 5000 ש""ח, ניתן גם לדבר על תקופה חלקית.","2015-07-07T06:23:41+0000","707688259256219_1027641963927512","",""
"","for sale brand new mobile phones unlocked and simfree sealed in the box with warranty  email: gadgets4ukretailltd2010@gmail.com skype: elect.deals2  APPLE IPHONE 6 16GB............................450$ APPPLE IPHONE 6 64GB.............................500$ APPPLE IPHONE 6 128GB............................550$ APPPLE IPHONE 6 PLUS 16GB .......................500$ APPLE IPHONE 6 PLUS 64GB.........................550$ APPLE IPHONE 6 PLUS 128 GB.......................600$ SAMSUNG GALAXY S6 32GB...........................500$ SAMSUNG GALAXY S6 64GB...........................550$ SAMSUNG GALAXY S6 128GB.........................600$ SAMSUNG GALAXY S6 EDGE 32GB......................550$ SASMUNG GALAXY S6 EDGE 64GB......................600$ SAMSUNG GALAXY S6 EDGE 128GB.....................650$ APPLE IPHONE 5S 16GB.............................250$ APPPLE IPHONE 5S 32GB............................270$ APPLE IPHONE 5S 64GB.............................300$ LG G4 32GB........................................400$ HTC ONE M9 32GB...................................400$ i can only respond to emails or skype messages  email: gadgets4ukretailltd2010@gmail.com skype: elect.deals2  TEL: +447937413550","2015-07-07T04:44:16+0000","707688259256219_1027822923909416","",""
"","מחפשת את החדר שאתם מבקשים לסאבלט במרכז תל אביב מתחילת/אמצא אוגוסט ועד סוף נובמבר או עד תחילת שנת הלימודים האקדמית. תודה! :-)","2015-07-07T04:28:23+0000","707688259256219_1027819600576415","",""
"","מסייע לידידה: סאבלט בנווה צדק, תשעה חודשים עד סיום חוזה, אפשרי גם אחרי. הדירה ללא סלון. לשותפה הנשארת שני חדרים מחוברים והחדר המיועד הוא בגודל כמעט 4X4 עם יציאה למרפסת שמש משותפת. בחדר מיטה ושולחן גדול, חסר רק ארון. דירה במיקום מצוין דקה מרוטשילד ומהים. 2,200 ש""ח לחודש  ענת - 054-5456301","2015-07-07T02:09:31+0000","707688259256219_1026843240674051","",""
"","","2015-07-07T02:07:25+0000","707688259256219_1027428433948865","",""
"","Due to cancellation, the sublet is still relevant!  Lowered price!! 11.7/05.8 Location: Old north- Yishayahu street. Steps from the beach, port & park hayarkon 2 bedrooms, big livingroom with open kitchen, renovated bathroom, balcony. Renovated building with elevator.","2015-07-07T02:02:54+0000","707688259256219_1027372587287783","",""
"","","2015-07-07T02:02:29+0000","707688259256219_1027573497267692","",""
"","מסבלטת את הסטודיו שלי לחודש אוגוסט - 35 מ״ר, כולל מטבח, שירותים ומקלחת, דירה מאובזרת ומרוהטת לחלוטין. מיקום מרכזי אבל שקט ממש מול כיכר רבין. 3200 כולל הכל.","2015-07-07T02:00:11+0000","707688259256219_1026730474018661","",""
"","שלום סבלט בתל אביב-מבקשת להוציא את @meir kohen מקבוצה בגלל עלימות מילולית שקטה בפוסט קודם שלי.","2015-07-06T23:05:00+0000","707688259256219_1027418170616558","",""
"","מחפשות שותף/שותפה לדירה המהממת שלנו. בדירה ארבעה חדרים. שלושה חדרי שינה גדולים וסלון. הדירה ממקומת ברחוב וייסבורג בשכונת רמות צהלה בתל אביב. קומה ראשונה מתוך 2. שלוש דירות סה""כ בבניין. כרגע בדירה שתי שותפות. כולל חניה פרטית ומחסן חיצוני. בחדר נשאר ריהוט בסיסי, מזגן, ארון, מיטה, שידה.  שאר הדירה מרוהטת קומפלט. ניתן להכניס בעלי חיים! קיימת אופציה להארכה. מחיר: 2000 ש""ח כולל ארנונה. לא כולל חשמל ומים. תאריכים:  23.07 - 23.11.15 לפרטים נוספים:  גיא 0509913091  We are looking for third roomate to our beautiful apartment. Located in Ramot Tzahala Tel Aviv (northern part of Tel Aviv). Four rooms in total, three bedrooms. Two roommates (females) are in the apartment right now and looking for third one male/female. The rooms and the livingroom are bigger than the average. Include private parking spot, and an external warehouse. The room is includes furniture such as: AC, bed, closet and ventilator. The rest of the apartment is completely furnished. Totally animal friendly. The price is 2000 per month includes Arnona (some kind of tax that everyone needs to pay). Not include other expanses such as: water and electricity.   Dates :  23.7 - 23.11.15  For more details  0509913091 Guy","2015-07-06T22:07:22+0000","707688259256219_1027700897254952","",""
"","***סבלט בחגים במרכז תל אביב*** בוגרשוב 92 פינת המליץ, ליד דיזינגוף סנטר, דירת שניים וחצי חדרים משופצת ומאובזרת, מזגנים, מכונת כביסה ואפילו 2 שירותים. מסבלטים בין התאריכים 5.9-6.10, מחיר 5100 פרטים בפרטי או בטלפון 050-7823563","2015-07-06T19:43:05+0000","707688259256219_1027660393925669","",""
"","","2015-07-06T19:41:39+0000","707688259256219_1027655593926149","",""
