"data__story","data__message","data__updated_time","data__id","paging__previous","paging__next"
"","אהלן חברים,   אני מחפש סבלט לדירה האדירה שלנו, לחודש שלם בתקופה הכי משוגעת בשנה 23.07-25.08!! (התאריכים יחסית גמישים)  הדירה ממוקמת באזור נוח ושקט, ברחוב דפנה/ שאול המלך, קרוב להכל,  2 דקות מעזריאלי, 5 דקות מאבן גבירול ואפילו יש חניה :)  הדירה מרוהטת בכל טוב מכף רגל ועד הסלון הענק שלה, מטבח משופץ, וחדר גדול שמתפנה! בדירה נשארים שני שותפים כיפים שישמחו להראות לכם את תל-אביב!  מחיר ₪ 2300 + ₪ 350 חשבונות   כל מי שמעוניין מוזמן לפנות בהודעה פרטית","2015-06-23T15:02:07+0000","707688259256219_1019892321369143","",""
"Moran Hochberg shared her post to the group: ‎סבלט בתל אביב לתקופות קצרות‎.","","2015-06-23T14:43:03+0000","707688259256219_1019882981370077","",""
"","אני מחפש סבלט ארוך טווח בתל אביב החל מאמצע ספטמבר. דירה קטנה או חדר בדירת שותפים. עדיף בדרום העיר.","2015-06-23T12:01:11+0000","707688259256219_1019901168034925","",""
"","מחפשת דירה לי ולבן זוגי לכל חודש ספטמבר. אם מישהו יודע אשמח אם תעבירו. תודה:)","2015-06-23T11:49:32+0000","707688259256219_1018705304821178","",""
"","מסבלטת את חדרי בבן יהודה פינת בן גוריון. לחודש יולי!!  2040 שח בלי חשבונות. דירת 3 חדרים גדולים עם 2 שותפות. לפרטים-צליל0543337024","2015-06-23T11:26:05+0000","707688259256219_1019890231369352","",""
"","מעוניינת לסאבלט את חדרי בדירה מתוקה ברחוב שלמה המלך בת""א בין התאריכים ה28/7-26/8 ₪ 2,500 המחיר כולל את החשבונות.  הדירה ממוקמת באזור אטרקטיבי במיוחד. בחדר הנוסף שותפה נהדרת:-) שקטה ומתחשבת. subleting a cool room. the apartment is on shalomon king st. dates: 28/7 -26/8. the price is 2500 NIS including bills. great location in the central part of the city, 10 min away from the beach. there is aroomate that stay in the apartment. great person, quite, easy to get along with.","2015-06-23T11:19:48+0000","707688259256219_1019888228036219","",""
"","סבלט באחלה דירה בשוק הפשפשים ביולי  https://www.facebook.com/noa.barak/media_set?set=a.10151708550729600.1073741829.521914599&type=3","2015-06-23T11:18:59+0000","707688259256219_1019888044702904","",""
"","סאבלט לקיץ!  חדר בדירת 2 שותפים, 14 ביולי עד 25 באוגוסט, בפרישמן דירה משופצת במצב מצויין!! 2900+ חשבונות לחודש. פרטים בפרטי.","2015-06-23T11:10:10+0000","707688259256219_1019791661379209","",""
"","Sublet from 11.7/05.8! In the best neighbourhood in tel aviv. Very central, old north neighbourhood, yermiyahu street.  Minutes away from the beach, the port and park hayarkon!  The apt has 3 rooms, 2 bedrooms with double beds. Big salon with open kitchen, renovated bathroom and balcony. Renovated building with elevator. Pm","2015-06-23T09:13:25+0000","707688259256219_1019722224719486","",""
"","דירה מהממת, ארבעה חדרים. שלושה חדרי שינה גדולים וסלון. הדירה ממקומת ברחוב וייסבורג בשכונת רמות צהלה בתל אביב. קיימת אופציה להארכה. שתי חניות, אופציה למחסן חיצוני. מחיר: 6000 ש""ח כולל ארנונה. לא כולל חשמל ומים. הדירה מתאימה לשלושה שותפים. הדירה ריקה משותפים כרגע, ניתן לבוא יחיד, זוג או שלושה (2000 כל שותף). תאריכים:  23.07 - 23.11.15 לפרטים נוספים:  נדב  0509913090  A wonderful apartment is available for four months,includes furniture. It has three bedrooms and one living room, four rooms in total. Located in Waissburg street in Ramot Tzahala Tel Aviv. Two parking spots, an exterior warehouse is optional. The price is 6000 nis includes Arnona. The apartment is suitable for three roommates. The apartment is empty now, which means it is possible to come alone, with pair or three people (2000 nis each)  Dates :  23.7 - 23.11.15  For more details  0509913090  Nadav","2015-06-23T07:47:27+0000","707688259256219_1019753761382999","",""
"","**סבלט ל-3 שבועות בת""א גבול גבעתיים** דירת 2 חדרים גדולה (60 מ""ר), משופצת ומעוצבת ברמה הכי גבוהה: מרווחת, מוארת ממוזגת ומאובזרת, מוצעת לסבלט בין התאריכים 22.7-11.8, מושלמת לזוג או יחיד.  הדירה עורפית, וממוקמת ברחוב שקט וירוק בקרבת דרך השלום (חנייה בשפע וגישה מהירה לנתיבי איילון) עלות לכל התקופה כולל חשבונות: 4300 ₪  פרטים נוספים בפרטי, רון","2015-06-23T07:26:27+0000","707688259256219_1019747884716920","",""
"","Short term. On Rothschild/Marmorek. Available from August 7th. 1 cozy bedroom in a two bedroom apartment (we're a couple living in the apartment and sleeping in the other room). High class living room and all equipt kitchen, huge fridge, aircon, washer, dryer…  Right on-top of Rothschild boulevard, 4 min from Shenkin, with a breathtaking view of Habima Square! 3700 shekels per month, not including bills. _________________________________________________________ .לתקופות קצרות .ברוטשילד / מרמורק. מתפנה מה -7 לאוגוסט (חדר שינה מתוק בדירת שני חדרים (אנחנו זוג המתגורר בדירה וישנים בחדר השני  ...סלון ברמה גבוה מטבח מאובזר קומפלט, מקרר ענקי, מזגן, מכונת כביסה, מייבש !משקיף על שדרות רוטשילד, 4 דקות משינקין, עם נוף עוצר נשימה של כיכר הבימה ש""ח 3700","2015-06-23T05:48:43+0000","707688259256219_1019474531410922","",""
"","סבלט לחודש יולי בן יהודה פינת בן גוריון(5 דק הליכה מהים!!) דירת 3 חדרים עם 2 שותפות. 2100 שח לא כולל חשבונות","2015-06-22T21:27:45+0000","707688259256219_1019020701456305","",""
"","*סבלט לשבוע* (2-9.7) המודעה פונה לכל המינים הנקיים, שלא מעשנים! אני >> טס לשבוע! אתה >> שומר לי על החדר המהמם שלי! עבור 700 ש""ח (כולל כל סוגי החשבונות) חדר ענק+ מרפסת(אין סלון.החדר והמרפסת ממלאים את מקומו מעולה!) ויצמן פינת ארלוזרוב קומה 3 נשארות 2 שותפות חייכניות :) (בנות 25-27) הדירה כשרה עדיפות למועמדים שישירו ו/או ינגנו לנענע ולבזיליקום שלי :P שלחו הודעה אם מתאים!  צ'או","2015-06-22T20:04:13+0000","707688259256219_1019435351414840","",""
"","מסבלטת את החדר שלי בדירה גדולה וכיפית בכרם התימנים. מדובר על שתי תקופות של עשרה ימים (אחת ביולי ואחת באוגוסט): 2-12.7 7-16.8 לחדר יש מרפסת פרטית עם נוף, וגם עוד מרפסת וסלון גדול. בדירה יש מלא אור, מרחב, כיווני אוויר. 2 דקות מהים, חצי דקה משוק הכרמל. בדירה נשאר שותף חמוד ונפלא. 1000 ש״ח לכל אחת מהתקופות.","2015-06-22T18:49:09+0000","707688259256219_1012497032108672","",""
"","סאבלט לדירת סטודיו נוחה וחמודה ליחיד ברח' נחמני (ליד רוטשילד)מתאריך 25 ליוני עד  15 ליולי 1900 ש""ח פרטים בפרטי","2015-06-22T13:56:44+0000","707688259256219_1019059061452469","",""
"","Sublet available from June 22 to August 30 Large bedroom in a 2 bedroom apartment  in the old north of Tel Aviv, on Bavli street. The room has a double bed, a private living room, a big closet and a desk. The apartment has a beautiful rooftop balcony and there is a washing machine, WiFi and everything you need for a short or long term stay. Host is a 40yo male, very clean and friendly. Rent is 2700 INS including all the bills.","2015-06-22T13:02:33+0000","707688259256219_1019192664772442","",""
"","סבלט לדירה שווה ביולי ביפו  https://www.facebook.com/noa.barak/media_set?set=a.10151708550729600.1073741829.521914599&type=3&pnref=story","2015-06-22T11:00:29+0000","707688259256219_1018923171466058","",""
"","מחפש סבלט עד לחודש ספטמבר  עדיפות לאיזור דרום ת״א כניסה מיידית  אשמח לפרטים .. קדימה לכו על זה 😉","2015-06-22T08:37:18+0000","707688259256219_1019038808121161","",""
"","for sale brand new mobile phones unlocked and simfree sealed in the box with warranty  email: gadgets4ukretailltd2010@gmail.com skype: elect.deals2  APPLE IPHONE 6 16GB............................450$ APPPLE IPHONE 6 64GB.............................500$ APPPLE IPHONE 6 128GB............................550$ APPPLE IPHONE 6 PLUS 16GB .......................500$ APPLE IPHONE 6 PLUS 64GB.........................550$ APPLE IPHONE 6 PLUS 128 GB.......................600$ SAMSUNG GALAXY S6 32GB...........................500$ SAMSUNG GALAXY S6 64GB...........................550$ SAMSUNG GALAXY S6 128GB.........................600$ SAMSUNG GALAXY S6 EDGE 32GB......................550$ SASMUNG GALAXY S6 EDGE 64GB......................600$ SAMSUNG GALAXY S6 EDGE 128GB.....................650$ APPLE IPHONE 5S 16GB.............................250$ APPPLE IPHONE 5S 32GB............................270$ APPLE IPHONE 5S 64GB.............................300$ i can only respond to emails or skype messages  email: gadgets4ukretailltd2010@gmail.com skype: elect.deals2  TEL: +447937413550","2015-06-22T08:24:13+0000","707688259256219_1019035308121511","",""
"","A.R-שיפוצים  תיקונים בכל הרמות (טייח,שפכטל וכו׳), גבס ,הנדי מן  צביעה מקצועית ומגוונת ועוד.  הנחות לסטודנטים !!!!!  התקשרו עוד היום בכדי לקבל הצעת מחיר בחינם !!! :  רון  - 0545247558 אסף - 0528341755 הדף שלנו - https://www.facebook.com/A.R.shiputzim","2015-06-22T08:24:11+0000","707688259256219_1019035301454845","",""
"","***SUBLET FOR JULY 10 - 15 *** Girls Only!! Ben Yehuda/Bograshov room in a renovated and beautiful appartment, kosher kitchen, close to the beach and everything you need. 180 shekels / day pm for pics","2015-06-22T08:24:03+0000","707688259256219_1019035234788185","",""
"","דירה מהממת, ארבעה חדרים. שלושה חדרי שינה גדולים וסלון. הדירה ממקומת ברחוב וייסבורג בשכונת רמות צהלה בתל אביב. קיימת אופציה להארכה. שתי חניות, אופציה למחסן חיצוני. מחיר: 6000 ש""ח כולל ארנונה. לא כולל חשמל ומים. הדירה מתאימה לשלושה שותפים. הדירה ריקה משותפים כרגע, ניתן לבוא יחיד, זוג או שלושה (2000 כל שותף). תאריכים:  23.07 - 23.11.15 לפרטים נוספים:  נדב  0509913090  A wonderful apartment is available for four months,includes furniture. It has three bedrooms and one living room, four rooms in total. Located in Waissburg street in Ramot Tzahala Tel Aviv. Two parking spots, an exterior warehouse is optional. The price is 6000 nis includes Arnona. The apartment is suitable for three roommates. The apartment is empty now, which means it is possible to come alone, with pair or three people (2000 nis each)  Dates :  23.7 - 23.11.15  For more details  0509913090  Nadav","2015-06-22T08:19:40+0000","707688259256219_1019033714788337","",""
"","סאבלט 3500 ש""ח לחודש החל מ 1.9 לארבעה חודשים  ברחוב עמישב, במרחק הליכה של דקות מעזריאלי ורכבת השלום דירה כייפית 60 מ""ר..2 חדרים ומרפסת מדליקה סגורה (ועוד מרפסת שרות) הדירה ממוזגת מרוהטת ומאובזרת לגמרי..יש דוד שמש  לפרטים נוספים  בפרטי או בטלפון 0505410067 מורן עופר","2015-06-22T06:20:53+0000","707688259256219_1018931491465226","",""
"","https://www.facebook.com/kobiji/media_set?set=a.10151993141440835.1073741838.549305834&type=3","2015-06-22T05:33:46+0000","707688259256219_1018915091466866","",""
"","דירה מהממת, ארבעה חדרים. שלושה חדרי שינה גדולים וסלון. הדירה ממקומת ברחוב וייסבורג בשכונת רמות צהלה בתל אביב. קיימת אופציה להארכה. שתי חניות, אופציה למחסן חיצוני. מחיר: 6000 ש""ח כולל ארנונה. לא כולל חשמל ומים. הדירה מתאימה לשלושה שותפים. הדירה ריקה משותפים כרגע, ניתן לבוא יחיד, זוג או שלושה (2000 כל שותף). תאריכים:  23.07 - 23.11.15 לפרטים נוספים:  נדב  0509913090  A wonderful apartment is available for four months,includes furniture. It has three bedrooms and one living room, four rooms in total. Located in Waissburg street in Ramot Tzahala Tel Aviv. Two parking spots, an exterior warehouse is optional. The price is 6000 nis includes Arnona. The apartment is suitable for three roommates. The apartment is empty now, which means it is possible to come alone, with pair or three people (2000 nis each)  Dates :  23.7 - 23.11.15  For more details  0509913090  Nadav","2015-06-22T04:57:32+0000","707688259256219_1018798341478541","",""
"","מעוניינת לסאבלט את חדרי בדירה מתוקה ברחוב שלמה המלך בת""א בין התאריכים ה28/7-26/8 ₪ 2,500 המחיר כולל את החשבונות.  הדירה ממוקמת באזור אטרקטיבי במיוחד. בחדר הנוסף שותפה נהדרת:-) שקטה ומתחשבת. subleting a cool room. the apartment is on shalomon king st.  dates: 28/7 -26/8. the price is 2500 NIS including bills. great location in the central part of the city, 10 min away from the beach. there is aroomate that stay in the apartment. great person, quite, easy to get along with.","2015-06-22T01:19:35+0000","707688259256219_1014972425194466","",""
"","","2015-06-21T20:58:48+0000","707688259256219_1018762361482139","",""
"","סבלט את החדר שלי בדירת 4.5 חדרים מסבלט חדר ענק עם חדר עבודה פרטי לדירה יש גג ענק 80 מטר ועוד מרפסת גדולה משותפת ל3 החדרים בדירה נשארות שתי שותפות מקסימות הסבלט לחודשי הקיץ יולי אוגוסט עם אופציה לעוד כמה חודשים הדירה ברחוב הס קרוב לים.. ולדיזינגוף ובן יהודה ובוגרשוב השכר הינו 2900 לחודש ללא חשבונות לעוד פרטים גיל 0544649462 sublet for july-augost and a few more months optional subletting my room in an amazing4.5 rooms flat the room has a private office the flat has a massive roof top 80m and a very big balcony 2 female flatmates are staying in the flat very big and neat kitchen 5 min walk from the beach the rent is 2900 not included for further details gil 0544649462","2015-06-21T20:05:36+0000","707688259256219_1017980254893683","",""
"","מחפש דירה לזוג, מרכז תא. סבלט לחודשיים-שלושה.","2015-06-21T18:42:36+0000","707688259256219_1018254088199633","",""
"","שלום לכולם מחפש דירה בתל אביב מרכז לחודשים שלושה הקרובים  מי בעד...?","2015-06-21T18:41:58+0000","707688259256219_1018509258174116","",""
"","מחפשת סבלט עם כניסה מיידית. חודשיים-שלושה, גמישה בתאריכים. משהו שיתאים לזוג, דירת שני חדרים, אפשרי גם דירת סטודיו/חדר. תל אביב עם עדיפות למרכז.. אשמח אם תפרסמו ואודה לעוזרים!","2015-06-21T18:41:27+0000","707688259256219_1018549324836776","",""
"","","2015-06-21T15:02:34+0000","707688259256219_1018574304834278","",""
"","Light and airy room in 3rd floor flat with a great roommate. Flat is a good size for 2 people 67SQM and everything a sublessor could need is awaiting.  Porch access and great ventilation from the bedroom. Flatmate is my cool sister, who is prone to study a lot.  Jerusalem Ave. 138 Jaffa. 5 minute bike ride to the shuk and 10 minutes by bicycle to the sea or NOGA. 2000 shekel a month/ not including electricity bills.  July 4th and October/November (flexible) for the exit.  budaminof@gmail.com  * חדר עם יציאה למרפסת, בדירה מוארת ומרווחת, 67 מטר, קומה 3. בדירה נשארת אחותי- בחורה חכמה ונעימה. 2000 לחודש, לא כולל חשבון חשמל. יפו, שדרות ירושלים 138. אוטובוסים לכל תל אביב ויפו ממש קרוב לדירה. 5 דק באופניים לשוק הפשפשים, 10 דקות לים. הדירה מתפנה ב 4.07 עד אוקטובר/נובמבר - גמיש.  budaminof@gmail.com","2015-06-21T14:27:09+0000","707688259256219_1018529454838763","",""
"","***SUBLET FOR JULY 10 - 15 *** Girls Only!! Ben Yehuda/Bograshov room in a renovated and beautiful appartment, kosher kitchen, close to the beach and everything you need. 150 shekels / day pm for pics","2015-06-21T14:20:03+0000","707688259256219_1018554581502917","",""
"","להשכרה דירת 3 חדרים, כ-100 מ""ר, משופצת מהמם עם 2 חניות פרטיות! ממוקמת בלב הצפון הישן על חוף מציצים. שני חדרי שינה מאסטר ענקיים עם מקלחת ושירותים לכל אחד. מטבח גדול ומפנק עם אי, מלאת חלונות ומוצפת אור. מתאימה לכל מי שרוצה להתפנק  מחיר 10,500 ש""ח  לתיאום רונה 052-8338338","2015-06-21T12:53:44+0000","707688259256219_1018494704842238","",""
"","-סאבלט ל1.7-1.10 -2100 שכ""ד בלי חשבונות. -דירת גג בבוגרשוב עם גג ענק פרטי. -דקה מהסנטר, חמש דקות מהים. -נשארים שני שותפים. -לא מתאים לזוגות. -לא גמיש בתאריכים מלבד אופציה להכנס ב1.8 במקום ב1.7.  זמין בפרטי למעוניינים.","2015-06-21T12:41:52+0000","707688259256219_1018489911509384","",""
"","סבלט מספטמבר עד אמצע אוקטובר באזור הכי שווה","2015-06-21T10:40:30+0000","707688259256219_1017466418278400","",""
"","for sale brand new mobile phones unlocked and simfree sealed in the box with warranty APPLE IPHONE 6 16GB............................450$ APPPLE IPHONE 6 64GB.............................500$ APPPLE IPHONE 6 128GB............................550$ APPPLE IPHONE 6 PLUS 16GB .......................500$ APPLE IPHONE 6 PLUS 64GB.........................550$ APPLE IPHONE 6 PLUS 128 GB.......................600$ SAMSUNG GALAXY S6 32GB...........................500$ SAMSUNG GALAXY S6 64GB...........................550$ SAMSUNG GALAXY S6 128GB.........................600$ SAMSUNG GALAXY S6 EDGE 32GB......................550$ SASMUNG GALAXY S6 EDGE 64GB......................600$ SAMSUNG GALAXY S6 EDGE 128GB.....................650$ APPLE IPHONE 5S 16GB.............................250$ APPPLE IPHONE 5S 32GB............................270$ APPLE IPHONE 5S 64GB.............................300$  i can only respond to emails or skype messages  email: gadgets4ukretailltd2010@gmail.com skype: elect.deals2  TEL: +447937413550","2015-06-21T10:07:29+0000","707688259256219_1018398504851858","",""
"","Rooms with Private Bathroom !!! - Partially split apartment  On Shenkin 55, 1 min from Rothschild Boulevard. Showing tomorrow Tuesday from 19:00 to 20:00, June 23th  (100 meter)  A 3 bedroom, high class apartment, with bathrooms and aircon for each room!!! All furniture as in pics: Super equipped kitchen (shared), 24h-hot water on gas, double beds, work tables, dinning corner, cupboards, storage room, washer and sun balcony (shared) overlooking Shenkin street.  ***Prices are per month and don't include bills***  -Large room with private bathroom, surround stereo, and shared balcony, available from 20th of July until 1st of September: 4000 shekels per month.    Long term rental from the 25th of August: -Medium room with private bathroom and shared balcony: 3700 shekels.  Third room has been rented.  Light contract, one month collateral. ----------------------------------------------------------------------------------------------------- ללא תיווך, דירה מפוצלת חלקית. חדרים עם שירותים ומקלחת פרטיים !!! ברחוב שינקין 55, דקה משדרות רוטשילד. מראה מחר שלישי בין 19:00-20:00 , ה-23 ליוני.  (100 מטר) דירת 3 חדרים, ברמה גבוהה עם שירותים ומקלחת פרטיים ומזגן לכול חדר!!! כל הרהיטים כמו בתמונות: מטבח סופר מאובזר (משותף), 24 שעות מים חמים על גז, מיטות זוגיות, שולחנות עבודה, פינת אוכל, ארונות, אזורי אחסון, מכונת כביסה ומרפסת שמש (משותפת) הצופה לרחוב  שינקין.  ***המחירים הם לחודש ואינם כוללים חשבונות***   -חדר גדול עם שירותים ומקלחת פרטיים, סראונד סטראו ויציאה למרפסת שמש משותפת, פנוי מה-20 ליולי ועד ה-1 לספטמבר: 4000 שקל לחודש  לתקופות ארוכות, פנוי מה-25 לאוגוסט. -חדר בינוני עם מקלחת ושירותים פרטיים ויציאה למרפסת שמש משותפת: 3700 שקל- -חדר שלישי מושכר-  חוזה קליל, חודש ערבות.","2015-06-21T09:32:45+0000","707688259256219_1018390108186031","",""
"","חדר בדירת שני שותפים מתפנה לכל חודש יולי..... השותף שלי טס לחו""ל בין התאריכים 1.7-2.8 חדר שינה גדול, פרקט חדש, מרפסת, סלון מגניב הדירה ברחוב שפינוזה 20, רחוב שקט ממש במרכז תל אביב (בין דיזינגוף לאבן גבירול) עלות: 3000 כולל חשבונות הודעות פה או בפרטי או ליצור קשר עם השותף שטס ohad blaiberg","2015-06-21T08:20:18+0000","707688259256219_1018372411521134","",""
"","July 15 - Oct 25, 3 Room Apt. Near Gordon Beach  Lovely and big 3 rooms apartment with balcony (73 square meters / 786 square feet). Great location next to Gordon beach & pool, and next to Dizengof/Ben Gurion, in a quiet street (Hayarkon / Ben-Gurion Blvd.). Walking distance to Dizengof shopping centre and to Tel Aviv Port. The apartment is fully furnished, two bedrooms with queen size beds and spacious living room with balcony. In the apartment: air-conditioning, a washing machine and a dryer, fully equipped kitchen (oven, stove-top, microwave, large refrigerator and everything you need), dining hall with a table for six, very large closet, internet connection and more. Price: 24,000 NIS for the whole period. Price includes all bills except electricity (paid separately according to actual consumption).  For details: 058-6239165, Oded  מסבלטים את הדירה שלנו ליד הים מה-15.7 ועד ל-25.10. דירת שלושה חדרים גדולה עם מרפסת (73 מ""ר) במיקום נהדר ליד חוף גורדון ובריכת גורדון, וליד דיזנגוף/בן גוריון, ברחוב שקט (רח׳ הירקון פינת בן גוריון). מרחק הליכה לדיזנגוף סנטר ולנמל ת״א. הדירה מרוהטת לחלוטין. שני חדרי שינה עם מיטות זוגיות + סלון מרווח. בדירה יש: מיזוג אוויר, מכונת כביסה ומייבש, מטבח מאובזר (תנור, כיריים, מיקרוגל, מקרר גדול וכל מה שצריך), פינת אכילה עם שולחן ל-6, ארון בגדים ענק, אינטרנט ועוד. מחיר: 24,000 ש״ח לכל התקופה. המחיר כולל גם אינטרנט, מים, ועד בית, ארנונה וגז, ולא כולל חשמל.  לפרטים: 058-6239165, עודד","2015-06-21T05:47:08+0000","707688259256219_1018123241546051","",""
"","היי, מחפשת סאבלט לזוג מתחילת יולי עד אמצע/סוף אוגוסט . בתודה מראש, אורלי","2015-06-20T20:21:29+0000","707688259256219_1018059561552419","",""
"","","2015-06-20T20:11:56+0000","707688259256219_1018055468219495","",""
"","היי! אני מחפשת סבלט לחודשיים ליולי-אוגוסט.בבקשה תכתבו עליי! תודה:-)","2015-06-20T17:56:26+0000","707688259256219_1017200704971638","",""
